{
  "schema_version": "1.0",
  "corpus_status": "review",
  "taxonomy": {
    "domain": "lessons",
    "category_id": "lesson-1",
    "category_label": "Création",
    "lesson_id": "lesson-1",
    "lesson_label": "Leçon 1 — Création"
  },
  "source": {
    "file": "chants_de_la_creation.html",
    "extraction_file": "extraction_lecon_1_creation.md"
  },
  "hymns": [
    {
      "schema_version": "1.0",
      "id": "1b68b768-3075-4141-a29b-05ccc830ae40",
      "title": "APO MWANZO",
      "status": "review",
      "versions": [
        {
          "id": "b8eb4a57-7d37-484f-ad86-fa662d042b4f",
          "language": {
            "code": null,
            "label": null,
            "status": "uncertain"
          },
          "title": "APO MWANZO",
          "source": {
            "file": "chants_de_la_creation.html",
            "position": 1,
            "number": "25",
            "reference": null
          },
          "taxonomy": {
            "domain": "lessons",
            "category_id": "lesson-1",
            "category_label": "Création",
            "lesson_id": "lesson-1",
            "lesson_label": "Leçon 1 — Création"
          },
          "content": [
            {
              "type": "source_block",
              "lines": [
                "(Apo mwanzo, Mungu aliziumba mbingu na inchi na bahari kubwa yoyo aa! Roho wa Mungu akatulia juu ya uso wa maji)2x"
              ]
            },
            {
              "type": "refrain",
              "lines": [
                "Sisi zote tuondokeni duniani tutembee juu ya bahari ili tuwe mbinguni muishimo baba, Mungu wa wenye uhai inchi yani mwili, mbingu yani roho ya Mungu, maji ni mafundisho, nuru ufahamu, giza ni upungufu."
              ]
            },
            {
              "type": "source_block",
              "lines": [
                "Mungu akatenga nuru na giza, nuru muchana, giza usiku yoyo aa!( Ati baba oh nuru ao oh giza)2x  ",
                "Inchi ikatoa majani kwa gisi yake mamboga na miti matunda na mbengu yoyo aa ! wana wa Mungu toeni matunda yenye kufaha toba."
              ]
            },
            {
              "type": "source_block",
              "lines": [
                "Mungu akaumba viumbe vienye uhai ayawani na ndege nyangumi majini yoyo aa! mutu akawa mumiliki wa viote yoyo aa!"
              ]
            },
            {
              "type": "comment",
              "lines": [
                "Baba twakushukuru iyawe yoyo mungu wa wenye uhai  ",
                "- Uliumba dunia  ",
                "- Kweli sita kuacha"
              ]
            }
          ],
          "media": {
            "audio_present": true
          }
        }
      ]
    },
    {
      "schema_version": "1.0",
      "id": "1e2e9f96-cf80-4634-87cd-57b065d2ebbf",
      "title": "BWANA MUNGU EH MUMBAJI WANGU",
      "status": "review",
      "versions": [
        {
          "id": "5342ec6c-df41-45f3-be6f-2512cda0f228",
          "language": {
            "code": null,
            "label": null,
            "status": "uncertain"
          },
          "title": "BWANA MUNGU EH MUMBAJI WANGU",
          "source": {
            "file": "chants_de_la_creation.html",
            "position": 2,
            "number": "30",
            "reference": null
          },
          "taxonomy": {
            "domain": "lessons",
            "category_id": "lesson-1",
            "category_label": "Création",
            "lesson_id": "lesson-1",
            "lesson_label": "Leçon 1 — Création"
          },
          "content": [
            {
              "type": "source_block",
              "lines": [
                "(Bwana mungu eh mumbaji wangu ni mufalme wa majabu) (kwaeli kweli kwaku tanda mbingu na harzi na vitu viote vijazamo baba ni mufalme wa majabu Mumbaji bwana yoyoyo eh baba ni mufalme wa majabu)."
              ]
            },
            {
              "type": "refrain",
              "lines": [
                "- Kwa siku ya kwanza bwana kaumba nuru  ",
                "- Kwa siku ya pili bwana katenga nafasi  ",
                "- Kwa siku ya tatu bwana kaumba miti  ",
                "- Kwa siku ya ine bwana akaumba miangaza  ",
                "- Kwa siku ya tano bwana kaumba nyama  ",
                "- Kwa siku ya sita bwana kaumba mutuEh baba mumbaji bwana yoyoyo eh baba ni mufalme wa majabu."
              ]
            },
            {
              "type": "source_block",
              "lines": [
                "njonii (njoni kua yesu) njoni uchukuwe nawe nira yangu hii, (nira yangu hii) nira yani musalaba. 2x"
              ]
            },
            {
              "type": "source_block",
              "lines": [
                "Bwana akapanda shamba upande wa mashariki mwa Edeni bwana akatia pale mutu yule alie mufanya na vitu viote viakuitajiwa bwana akatia pale."
              ]
            },
            {
              "type": "source_block",
              "lines": [
                "Umu shambani bwana ka watilia sheria ule viote unavio viona mbele yako eh ila wakujuwa uzuri na ubaya wewe mutu wangu usile. Ukosefu wa watu wakakufuru yoyoyo watu wakufuru mungu wao."
              ]
            }
          ],
          "media": {
            "audio_present": false
          }
        }
      ]
    },
    {
      "schema_version": "1.0",
      "id": "cc83ce03-99fb-4c0a-9dda-10daae056a83",
      "title": "NITAZAMAPO HUDUMA ULIOFANYA MUNGU",
      "status": "review",
      "versions": [
        {
          "id": "063c0780-9c84-45f2-b31b-c8b79496242e",
          "language": {
            "code": null,
            "label": null,
            "status": "uncertain"
          },
          "title": "NITAZAMAPO HUDUMA ULIOFANYA MUNGU",
          "source": {
            "file": "chants_de_la_creation.html",
            "position": 3,
            "number": "34",
            "reference": null
          },
          "taxonomy": {
            "domain": "lessons",
            "category_id": "lesson-1",
            "category_label": "Création",
            "lesson_id": "lesson-1",
            "lesson_label": "Leçon 1 — Création"
          },
          "content": [
            {
              "type": "source_block",
              "lines": [
                "Nitazamapo huduma uliofanya Mungu kwa mikono yake chini ya jua (kweli mimi) sina na furaha mu mambo yote ya uzima wangu apa duniani."
              ]
            },
            {
              "type": "refrain",
              "lines": [
                "Mungu akaumba mbingu na dunia mito na bahari kubwa kazi ya mikono yake mungu wangu paka wewe akuna mwingine."
              ]
            },
            {
              "type": "comment",
              "lines": [
                "- Mumbaji wangu paka wewe akuna mwingine  ",
                "- Tegemeo langu paka wewe akuna mwingine"
              ]
            },
            {
              "type": "source_block",
              "lines": [
                "Mungu uniokowe mu mambo ya dunia ili ni sione taabu ya mwisho wa dunia (wewe) wewe ulimutoa mwana wako wa peke ili kila mwamini asife kamwe."
              ]
            },
            {
              "type": "source_block",
              "lines": [
                "ukiapa kwa mungu wako usisite kamwe timiza naziri yako (kweli yeye) yeye a furahi juu ya wajinga urejee kamwe timiza haadi yako."
              ]
            }
          ],
          "media": {
            "audio_present": false
          }
        }
      ]
    },
    {
      "schema_version": "1.0",
      "id": "3c650e65-7dd0-4432-80d9-9fcbbc1ab39d",
      "title": "ANASA WA DUNIA",
      "status": "review",
      "versions": [
        {
          "id": "4e436c8e-45f7-4060-bda2-eb9f6d66539d",
          "language": {
            "code": null,
            "label": null,
            "status": "uncertain"
          },
          "title": "ANASA WA DUNIA",
          "source": {
            "file": "chants_de_la_creation.html",
            "position": 4,
            "number": "32",
            "reference": null
          },
          "taxonomy": {
            "domain": "lessons",
            "category_id": "lesson-1",
            "category_label": "Création",
            "lesson_id": "lesson-1",
            "lesson_label": "Leçon 1 — Création"
          },
          "content": [
            {
              "type": "source_block",
              "lines": [
                "Anasa, anasa za dunia zimetusonga sana oh anasa za dunia."
              ]
            },
            {
              "type": "refrain",
              "lines": [
                "Roho wewe ndiye mungu (eh roho) roho oh wewe ndiye mungu (Eh roho wewe ndiye mufalme kuliko mafalme za dunia)2x"
              ]
            },
            {
              "type": "source_block",
              "lines": [
                "(Roho ulinena ya kwamba maji na maji ya tengane maji ya juu na maji ya chini)2x (Katikati ukaita nafasi, nafasi ukaita mbinguni)2x Oh oh roho wa baba nafasi ukaita mbinguni."
              ]
            }
          ],
          "media": {
            "audio_present": false
          }
        }
      ]
    },
    {
      "schema_version": "1.0",
      "id": "3220d5f5-702a-437f-8ad6-54a810e73b07",
      "title": "MUNGU ALIANZA KAZI",
      "status": "review",
      "versions": [
        {
          "id": "bb417759-d707-48f3-a427-4d02bcd630d5",
          "language": {
            "code": null,
            "label": null,
            "status": "uncertain"
          },
          "title": "MUNGU ALIANZA KAZI",
          "source": {
            "file": "chants_de_la_creation.html",
            "position": 5,
            "number": "29",
            "reference": null
          },
          "taxonomy": {
            "domain": "lessons",
            "category_id": "lesson-1",
            "category_label": "Création",
            "lesson_id": "lesson-1",
            "lesson_label": "Leçon 1 — Création"
          },
          "content": [